{
  "schema_version": "2.0.0",
  "status": "valid",
  "file": "demo.jky",
  "diagnostics": [],
  "truncated": {
    "errors": false,
    "warnings": false
  },
  "metadata": {
    "module": "demo",
    "selected_targets": [
      "ubuntu"
    ],
    "profile": "standard",
    "entry": {
      "name": "demo.main",
      "required_privilege": "user",
      "capabilities": [],
      "supported_platforms": [
        "windows",
        "ubuntu"
      ],
      "unavailable_dependencies": []
    },
    "functions": [
      {
        "name": "demo.main",
        "required_privilege": "user",
        "capabilities": [],
        "supported_platforms": [
          "windows",
          "ubuntu"
        ],
        "unavailable_dependencies": []
      }
    ]
  },
  "language_version": "3.0.0",
  "registry": {
    "schema_version": "2.0.0",
    "fingerprint": "aaaaaaaaaaaaaaaaaaaaaaaaaaaaaaaaaaaaaaaaaaaaaaaaaaaaaaaaaaaaaaaa"
  }
}
